text,label
लोकगीतको सुरुवात red_heart,2
आदरणीय जेठान लाई सलाम छ red_heartred_heartred_heartfolded_handsfolded_handsbouquetbouquet,1
तपाईंको लाखौं शुभचिन्तक मध्यको एक म पनि हो प्रकाश सर्smiling_face_with_hearteyessmiling_face_with_hearteyes सधैं माया ,1
निरन्तर चलिरहोस दाइ,1
बागिना हेर्दा किन किन असाधै मजा आउँछ धन्यबाद छ प्रकाश अन्कल लाईfolded_handsred_heartred_heart,1
प्यारो प्रकाश दादा love from panchtharred_heart,1
अब मजा आउँछ हेर्न आज को के कस्तो छ खुराक rolling_on_the_floor_laughingrolling_on_the_floor_laughingrolling_on_the_floor_laughing,1
म त big fan हो प्रकाश दाइको,2
प्रकाश सर को चोतिलो कुरा सारै मन पर्छ तपाईं हरुलाइ नि,1
काका बिग फ्यान्face_blowing_a_kissface_blowing_a_kiss,1
प्रकाश अंकलको प्रसंसक हूँ  भैरहन पाऊँ,1
हजुरहरुको यति धेरै माया र साथको लागि एकदमै आभारी छुfolded_hands आउदों हप्ता बाट द भ्वाइस किड्स को लाइभ राउण्ड सुरु हुदैं छ मलाइ हजुरहरुले भोट गरेर साथ दिन सक्नुहुनेछ अबको निर्णय दर्शककै हातमा छred_heart,1
समग्रमा नेपाली गीत संगीतको त्यो युगदेखि यो युगसम्मकाे  यथार्थ चित्रण गर्ने एकमात्र कार्यक्रम बागीना,1
यो भाग चाइ राम्रो लाग्यो पुराना कलाकर जा श्रीजना चोरी गर्ने लाई कार्बाइ होस,0
सादना कुन चराको नाम हो भन्न नजान्ने वेसुरा मारथी रात रात सेलिब्रिटी भन्नु भएको चै सारै रमाईलो लाग्यो दाजु आगमि एपीसोड को लागी हार्दिक शुभकामना र उज्ज्वल भविष्य को कामना छ organicbg gurung,1
दाई मेरो सुझाव यो गीत को music video ko news program सस्तो बढी झल्को आयो यसलाई अली काम गर्ने हो की र संगीत संगीत का वृक्रीती र न्याय मा बढी फोकस गर्दा राम्रो होला की folded_handsfolded_hands,2
हार्दिक श्रध्दाञ्जलि स्वर्गिय लोक बहादुर कार्की ज्यु तर बोतलको पानी र कार्कि ज्युको गित त्यस्तै चहि छैन है किनकि लोक बहादुर कार्की ज्युको मेलोडी भजन जस्तै छ अर्को बोतलको पानीले अर्कै मेलोडि छ  अनि सुन छोरा मुजि गेडाको क्षेतिपुर्ति मुजि,0
पहिला भन्दा आज भोलि हजुर ठिक लाग्न लाग्यो sparkling_heart,1
कुखुरा roosterचोर person_runningहरुले अबो गीत musical_score     संगीत guitarपनी चोर्न थाले अब ति चोरहरुलाइ person_runningच्याप्पो समातेर खोर भित्र हाल्नु पर्यो काका smiling_face_with_sunglasses अनि जरिमाना पनी भराउनु पर्यो ,0
म भारतको दार्जलिंग बाट आएर नेपालको उत्कृष्ट रियालिटी शो द भ्वाइस किड्स मा परस्तुति दिदा पनि यति धेरै माया र साथ को लागि एकदमै आभारी छु red_heartred_heartfolded_hands मलाइ हजुरहरुले भोट गरेर भरपुर साथ दिनुहुनेछ आशा छ,1
देशको माया विदेशमा हुने नेपालीलाई सोध ,1
यदि सत्यतथ्य  बोल्दा कसलाई  पछ र काका तर   तपाईं  कुनै पनि कुरा उठाउनु  नछाड्नु काका बागिना टिम लाई  सुभकामना,1
बाजे माइक मा खास खुस भै छ rolling_on_the_floor_laughing,1
सलाम छ डिल्ली अधिकारीलाई,1
रजटपट अङ्कलको सपोर्ट यता हाजिर हुनुहोला हैraised_hand_with_fingers_splayed,1
आयो है चिप्ल्याउने अङ्कलको झटारो rolling_on_the_floor_laughingrolling_on_the_floor_laughing,2
नेपाल   love u ,2
गु लाई नचलाको राम्रो  ,0
बोतलको पानीले भन्ने गित चहि फरक छ है मुजि हावाअ नबोल हाम्रोनि कान छ मुजि,0
दुर्गेसलाई आज नि  ड्च हान्नु पर्थ्यो नि काका,0
कार्यक्रम धेरै राम्रो छ येस्तै गर्दै जानु सुभकामना,1
चिप्ल्याउने अन्कलले कसैलाई नछाड्ने भोface_with_tears_of_joy,0
यो गीत टप वान्मा हुन्छ यो बर्स,2
प्रकाश दाइ त साच्चिकै चिप्लाउने uncle रैछ face_with_tears_of_joy खोकनाको श्रीकाली चौर कि भैसिपातीको चौर,2
यसरी ठाउँको नाम नै चिप्लाइ दिसकेपछी चिप्लौने uncle भन्दैन तangry_faceangry_faceangry_face,0
ट्युनिङ् मात्र चोरी हुँदात ठीकै होला तर शब्दनै चोरी हुँदाचाहिँ अतिनै नराम्रो भयो,0
निशब्द बनाई दिनुहुन्छ ढिल्ली दाइकाे भावनाले जिउदो विभूति जस्तो लाग्ने गर्छ कसरी भन्नू  ढिल्ली दाइ जस्तो भुटान बाट आउनुभएको सम्पुर्ण नेपाली हरुलाई बिदेशी भनेर बिधानले जे भनाेस तर मनले त हिजो पनि मान्दैन थियो आज पनि र कहिलै पनि मान्नेछैन loudly_crying_faceloudly_crying_faceloudly_crying_faceloudly_crying_faceloudly_crying_facefolded_hands,0
झ्याप मा फेरि अर्को र्याप बनाइदेलान rolling_on_the_floor_laughingrolling_on_the_floor_laughingrolling_on_the_floor_laughingrolling_on_the_floor_laughingrolling_on_the_floor_laughingrolling_on_the_floor_laughingrolling_on_the_floor_laughingrolling_on_the_floor_laughingकति हास्नु हौ,2
कार्यक्रम अरु सबै ठिक यो म्युजिक vdo shotting मा जाने काम अलि प्रभावकारी होईन कि,0
मेरो बाबा को गित संगित चोरी भो क्षतिपूर्ति मलाई चाहियो,0
क्षतिपूर्तिसहित कार्बाही हुनु पर्यो भनेको मात्र भए ठिकै हो  भने पछी केटो ले कामै नगरी बसी२ क्षतिपूर्ति खाएर लिएरै बस्ने सोच बनाएछन्,0
कस्तो बाऊ को छोरा हो यो ,2
स्वर्गीय लोक बाहादुर प्रति सर्दा सुमन ,1
the voice of kids मा मलाई माया गर्ने सम्पूर्ण संसार भर रहनु भयका आमाबुबा दादादीदी हरु मा मेरो हृदय देखि नमन गर्दै मेरो नया च्यानल मा पनि जोडिदिनु होला धन्यवादfolded_hands,1
म्युजिक भिडियो चाहिँ फेसन नै भयो face_with_rolling_eyes,2
बोली तीखो तर सहि पनि छ,1
लास्टमा झ्याप्पमा र्याप्प रे काकाले rolling_on_the_floor_laughingrolling_on_the_floor_laughing,0
एक छिन त रजतपट हेर्दै पो छु कि जस्तो लागेएको थियो,2
म धमला र सुबेदी का सबै प्रोग्राम हेर्छु,2
प्रकाश सर चलाख रहेछन   यो यपिसोट बाट प्रकाश सर ले ३ लाख कमाए ,1
चिपल्याउने अङकल लाई बधाई छ,1
ऋषि अधिकारी ले गायेर सुनायेको गित र बोतलको पानीले भन्ने भाका उस्तै छैन है धेरै फरक छचोरेको जस्तो लागेन भोजराज काफ्लेको बदनाम गर्न मात्रै  खोजेको जस्तो लाग्यो,0
जे जस्तो बोले पनि सत्य बोल्छ है काका,1
बुलबुल फिल्म मा रहेको एक बाक्य ठाडो बाटो जाम सुस्तै सुस्तै,1
बिर्सने लाई सम्झने म उस्तै भन्ने गित,1
वसन्त थापा को  जाम सुस्तै एउटा पुरै गित बन्यो को पहिला होला,1
डिल्ली राज अधिकारी को भिडीयो,1
पनि नेपाली कला क्षेत्रमा चलिरहोस् ,1
उनको त्यो टालो लगाईएको कोटलाई,1
नि आफैसङग बडो ईज्जतका साथ नेपाली,1
डिल्ली राज अधिकारी को भिडीयो,2
पनि नेपाली कला क्षेत्रमा चलिरहोस् ,2
उनको त्यो टालो लगाईएको कोटलाई,2
नि आफैसङग बडो ईज्जतका साथ नेपाली,1
डिल्ली राज अधिकारी को भिडीयो,2
पनि नेपाली कला क्षेत्रमा चलिरहोस् ,2
उनको त्यो टालो लगाईएको कोटलाई,2
नि आफैसङग बडो ईज्जतका साथ नेपाली,2
डिल्ली राज अधिकारी को भिडीयो,2
पनि नेपाली कला क्षेत्रमा चलिरहोस् ,2
उनको त्यो टालो लगाईएको कोटलाई,2
नि आफैसङग बडो ईज्जतका साथ नेपाली,2
डिल्ली राज अधिकारी को भिडीयो,2
पनि नेपाली कला क्षेत्रमा चलिरहोस् ,2
उनको त्यो टालो लगाईएको कोटलाई,2
नि आफैसङग बडो ईज्जतका साथ नेपाली,1
दुर्गेश थापा लाई कडा दिनु परो काका निउ खोजेको खोजै गर्छ त सोर सम्राट भए र होलाface_with_tears_of_joy,0
काकाले हान्दै हुनुहुन्छ जे होस बोली खरो छ दुर्गे,0
प्रकाश सर निडर मान्छे सलाम छ,1
paul भएर हिट भयको हो यो गित ,1
दुर्गेस लाई मुन्ट्याएर सोध्नु परो face_with_tears_of_joyface_with_tears_of_joy,2
यी अंकल को कार्यक्रम को भिडियो र कबडि फिलिम सिरिज हेर्न जहिलै आत्तुर म,2
हाम्रो काकाको बोलिमा दम छ ,1
याे कार्यक्रम ककस्लाई मन पर्छ  कमेन्ट् गर्नुहाेसheavy_heart_exclamation,1
real hero megha star my heart paul da always so excited all project अनि म यस्तो गीत गाउँछु  2 माघ 19 गतेदेखि नेपाल का प्रत्येक हल हल मा लाग्दै छ है धेरै माया दिनको लागि प्रतीक्षा गर्नु होला folded_handsfolded_handssparkling_heartsparkling_heart,1
लोक दोहोरी गीत त कुनैकुनै गीत छोडेर बाकी गीत सुन्ने हो भने कतै शब्द कतै लय भाका थेगो चोरी भैई नै राखेको हुन्छ अझ भन्ने हो भने त स्टुडियोमा एउटा सर्जकले रेकर्ड गरिसकेको गीत अर्कोले स्टुडियो मै सुनेर अर्कै स्टुडियोमा तेहि गीतमा आफ्नो नाम हालेर रेकर्ड गर्दिन्छ र ओरिजिनल भन्दा पैला नै बजारमा ल्याएर चर्चामा अब यो भन्दा बाकी के भन्नु हे साङ्गितिक क्षेत्रका चोर महापुरुष हरु,0
सोल्टी सङ्गीत सारथि smiling_face_with_open_mouth__cold_sweatsmiling_face_with_open_mouth__cold_sweatsmiling_face_with_open_mouth__cold_sweat,2
हामिले देश प्रति जति नै माया गरेपनि हाम्रो देस को घिनलाग्दो राजनिति र देख का नेता हरु ले पनि उतिकै माया गरिदिए पनि हुन्थ्यो नि,1
यस्तो भित्र पनि चोर हुन्छ र,0
चिप्ल्याउने अङ्कल को अन्तिम शब्द backhand_index_pointing_rightझ्याप मा फेरि अर्को र्याप बनाइदेलाbackhand_index_pointing_leftgrinning_face_with_smiling_eyessign_of_the_hornssign_of_the_horns,2
हाम्रो अन्कल,2
manju mahat को सम्झना मा पनि कार्यहरू गराउनु न है  सोर्गिय मन्जु महत,2
प्रकाश सुवेदि कलाकारिता भित्रका झुटबाजी हरुको लाई प्रहरि पत्रकार नै हुन,2
धेरै छ गित चोरी भयको,0
बेसुरा महारथी अनि अन्तर्वार्ताrolling_on_the_floor_laughingrolling_on_the_floor_laughingrolling_on_the_floor_laughingrolling_on_the_floor_laughingदरो हान्नु भयो अङ्कलले दुर्गेशे लाईseenoevil_monkeyseenoevil_monkeyseenoevil_monkeyseenoevil_monkey,0
झ्याप मा र्याप हान्ने को हुन दुर्गेस थाहा,2
फिल्म छेत्र मा  सबै  सङग  दुस्मनी गरिसकेर यो  बुढो   अब  गीत सङीत छेत्र  तिर  बर्बरौन  आयेछ,0
दाइ  तितो बोल्नु हुन्छ  तर  सत्या  बोल्नु  हुन्छ,1
भिडियो खिचेर मलाई पठाउनु रेface_with_rolling_eyes के गर्छौ यसो गरेमा,2
दुर्गेस चोर डाका हो सबै ले बहिष्कार गरौं,0
प्रकाश सर दर्सन गरे होउ,2
सुरक्षा भतराइको रिपोत दामी,1
तपाईंको जतिसुकै कार्यक्रम आए पनि नेपालमा सुपरहित हुनेछन् जस्तो लाग्छ  तपाईंको सत्य तथ्य आवाज सधै बोलिराख्नुहोला  सधै साथ सहयोग हाम्रो भै राख्ने छ smiling_face_with_hearteyessmiling_face_with_hearteyes,1
माहानाएक को बारेमा धेरै राम्रो ब्याख्या गर्नु भो सारै राम्रो लागो दिलिप सरको धेरै ठूलो फ्यान हो म,1
दिलिप सर धेरै नै रमाइलो हुनु हुन्छधेरै नै मनपर्छheavy_heart_exclamationheavy_heart_exclamationउहाँको बोली ब्यबहार dance सबैको फ्यानheavy_heart_exclamationheavy_heart_exclamationheavy_heart_exclamationfolded_handsfolded_handslots of love dilip sirheavy_heart_exclamationheavy_heart_exclamationfolded_hands,1
आफ्नाे मान्छे भनेकाे आफ्नै हुन्छ सबै मुटुमा बस्ने दिलिप सर folded_hands,1
राजेस दाइ को बारे मा जे बोल्नु भो खुसी लागो दाजु राम्रो भनु भो तपाईं को कुरा ले मन त दुखेको थियो तर   आज राम्रो लागो,1
लामो समय पछि दिलीपजी को कुरा सुन्न पाउदा खुशी लाग्यो ,1
दिलिप दाइ को बिग फ्यान्दर्पणछायाबन्धकि  मुग्लान आफ्नो मान्छे नौ डाडापारिजीन्दगानि अन्जान मै माय बस्ला है धेरै मन परेको  मुभि,1
अब अर्को हप्ता बाट द भ्वाइस किड्स को लाइभ राउण्ड सुरु हुदैं छ मलाइ अझ धेरै हजुरहरुको साथ र सहयोग चाहिएको छ म आशावादी छु हजुरहरुले मलाइ भोट गरेर  भरपुर साथ र सहयोग दिनुहुनेछ folded_handsred_heart,1
प्रकाश सर को कार्यक्रम नहेरी खाना खानै मन लाग्दैन  हरेक दिन एउटा एउटा चाहियो red_heartfolded_hands,2
दिलीप रायमाझी लाई देख्दा स्वर्गीय श्रीकृष्ण श्रेष्ठ ज्यूको झलझली याद आउँछ,2
धन्यवाद छ प्रकाश जि साथै दिलिप जि लाई पनि आजाको भाग सार्है रमाइलो लाग्यो हाम्रो दौँतरी आफ्नै जोडी धेरै खुसी लाग्यो हुनु त दिलिप जि आकाशको जुन हुनु भयो म चाहिँ धर्ती को धुलो हो तर पनि धेरै खुसी लाग्यो पुरानो कलाकार आफ्नै जोडी दौँतरी देख्नु पायो धेरै धेरै धन्यवाद हजुरहरुलाइ,1
कस्तो राम्रो बक्ता यार दिलिप दाइ को अतिनै राम्रो बिचार एस्तो पो हुनु पर्छ त मान्छे त,1
अस्थी दिलिप दाई को खेदो खनेर आज शो मा बोलाउनु भएछ rolling_on_the_floor_laughingrolling_on_the_floor_laughingrolling_on_the_floor_laughing,0
धेरै रमाइलो लाग्यो red_heartred_heartred_heart,1
चिप्लेटी uncle जतिखेर नि चिप्ल्याउनु खोज्नुहुन्छ्face_with_tears_of_joyface_with_tears_of_joyface_with_tears_of_joy,2
गलामर गफ सारै रमाइलो लाग्यो  आज अभि नेता दिलिपले हसाउनु हसाए grinning_face_with_smiling_eyesgrinning_face_with_smiling_eyesgrinning_face_with_smiling_eyes,1
चलचित्रमा जुनै सुकै पनि भुमिकामा न्याय गर्न सक्ने कलाकार नायेक म दिलिप दाइको ठुलो दर्सक,1
नेपाली चलचित्रको अब्बल डान्सको कलाकार स्व श्रिक्रिश्न श्रेष्ठ होउहाँडान्समा मात्र होईनअभिनयमा पनि पोख्त हुनुहुन्छधेरै धेरै सम्झना श्रि दाईfolded_hands,1
प्रकाश बाबु यो कार्यक्रम सारै मनपर्छ दिलिप बाबु झनै मनपर्छ हाम्रो नेपाल जस्तो त बिष्वमा कहिं छैन,1
प्रकाश जि त तेसै रमाइलो मान्छे,1
तेसै माथी दिलिप जि लाई यो सो मा उपस्थित गराउनु भयो,2
अति नै रमाइलो भो दुबै पर्ति उच्च सम्मान छrosefolded_hands,1
रजतपट अङ्कल नमस्कार हजुर को कार्यक्रम यकदमै खास लाग्छ यहाँको बोल्ने शैली कसैसङ्ग नडराइ बोल्ने शक्ति हजुर लाई धेरै धेरै धन्यवाद ,1
रजतपत काका को कार्यक्रम,2
सधैँ उत्कृष्ट लाग्छ जिन्दावाद,1
काका जिन्दावादflexed_bicepsbackhand_index_pointing_left,1
एकदम राम्रो बिचार दिलिप जि को आफ्नो देश प्रति को माया र सबै नेता  देखि कलाकार सम्मा को सम्मान अति रमाइलो कुरा कानी गर्नु भो सम्मान को साथ सलाम छ,1
धेरै नै रमाइलो अनि सफा मन्को मान्छे जस्तो लायो  दिलिप जि को कुरा हरु सुनेर red_heartred_heart,1
ब्याटल पछि म टिम राजुबाट टिम प्रबिशामा छु  मलाई आशा छ तपाईहरुले फेरि पनि पहिलेको जस्तै माया गर्नु हुनेछ भनेर ,1
मन पर्ने हिरो दिलिप रायमाझी red_heart,1
प्रकाश दाई को कुनै पनि प्रोग्राम नछुट्टाईकन हेर्ने को को हुनुहुन्छ ,2
ठिकै हाे दिलिप दाइ ईनिहरुलाई चिन्नु अावशयक पनि छैन,0
चिप्ले काका को सो नहेरी मजानै लाग्दैन grinning_facegrinning_facesmiling_face_with_hearteyesface_blowing_a_kissface_blowing_a_kiss,1
