text,label
राम्रो प्रश्तुती रवि दाई को कायक्रोम अविन्ता को पीडा  ले आँसु आयो ,0
यति ठूलो लोककान्त्रिक तथा गणतान्त्रिक संबिधानमा आमाकोमात्र नामबाट पनि नागरिकता दिलाउन सकिने व्यवस्थाको ग्यारेन्टी किन हुन नसकेको  यो सोचनिय विषय होईन र ,0
यो नानुको कुरा सुनेरा मेरो आखाबाटा आँसु आयो,0
केटा मान्छे हुँ तर पनि आशु रोकिएन यस्ता राक्षस बाबुहरुलाई त हातखुट्टा भाच्ने गरेर हानेर बल्ल ठाउँमा आउँछ mula सबै जनाले यो सेयर गर्नुहोला र उहाँको अधिकार चाँडै नै पाउनु पर्यो folded_handsfolded_hands,0
folded_handsfolded_handsfolded_handsनमस्कार   रबि  सर  हजुर  लाई  धन्यवाद  छ रबि सर  सिधा कुरा  मलाई   सारै  मन पछ smiling_face_with_hearteyessmiling_face_with_hearteyessmiling_face_with_hearteyessmiling_face_with_hearteyessmiling_face_with_hearteyes,0
बाह मेरो देश नेपाल जब नेपालि नागरिकता  भएको आमा बाट जन्मेको बच्चालाइ नागरिकता दिलाउन स्ंघर्श गर्नु पर्ने तर बिदेशिलाइ पैसामा कति छिटो नागरिकता दिलाउलाउछ्,0
अब त्यो राउत लाई  जसरी भय पनि मिडियामा ल्याउनु पर्छ याे नानू लाई जसरि भय पनि न्याय दिलाउनु पर्छ  ,0
बैनिको कुरा सुनेर आसु नै आयो भन्याdisappointed_but_relieved_face  बैनिले छिटो नागरीकता पाउन,0
रबि सरकाे जुनसुकै कार्यक्रम पनि सारै राम्रो लाग्छ राम्रो गर्दै जानू रबि सर सलाम छfolded_handsgreen_heartred_heartfolded_hands,0
भारतीयहरुलाई सजिलै नागरिकता बेच्ने यो देशका सरकारी पत्रु भ्रष्ट हरुले आफ्नै देश नेपालमा जन्मिएको अविन्ता  जस्ता चेलीको सबै प्रमाण हुँदा हुंदै पनि नागरिकता नदिनु निकै दुःखद कुरा हो ,0
आफ्नै देश मा जन्मेर नागरिकता न पाउनु ठूलो बिडमबना हो crying_face कानुन अनुसार आमाको नाम बाट नि नागरिकता पाउने प्रधान छ  कसरी हुन्छ अमिन्ता लाई नेपाल सरकार ले तिरुन्तै नागरिकता दियोस,0
मार्मिक सब्दले मन छोयो छोरि,0
रबि सर लौन त्यो हेमराज सग कुरा गर्नुस  हजुर्लाइ सारै भन्यो त्यो मान्छेले,0
भारतिय नागरिकलाई सजिलै नागरिकता मिल्छ तर आफ्नै देशको नागरिक लाई पाउन गाह्राे छ धिक्कार छ यार,0
यो छोरी को पीडा सुन्दा मन थाम्नै सकिन भगवान crying_faceloudly_crying_face त्यो त्यो जन्तु लाई ठूलो कार्बाही हो्स  त्यस्लाई जुनि जुनि जिउदा पनि नसक्कियोस्  त्यस्को पाप पापी लाई,0
अब चुनाव मा उठनुस रबि सर हाम्रो आग्रह छ हजुर लाई ,0
भ्रष्टहरु लाई जति कराए पनि भने पनि टेर्ने होइन खै ,0
धेरै  राम्रो कार्यक्रम folded_hands,0
सलाम छ रबी सर लगायत का सबै टीमलाई folded_handsfolded_handsfolded_handsred_heartred_heartred_heart,0
म पनि सेटिन गरेर बनाएर आछु काठमाडौमा रहेको साउन्डलाइन्स म्यानपाबरले बनायको नक्कलि qr code 5 हजार खायो तर मैले खोप लाको छैन हाल कतारमा,0
धेरै राम्रो कार्यक्रम छ म रबि सरको big fan हो  त्यसैले म यो कार्यक्रम नछुटाई हेर्ने गर्छु अरु भन्दा हामी सबैलाई रबि सरको ओपनिङ कै ५ मिनेट काफी हुन्छ अरु त सबै कार्यक्रम एकदमै राम्रो हुन्छ,0
अमिन्ता रावत लाई सरकारले नागरिक ता दिन जरुरी छ ,0
मन मुटु ह्रदय बाट नै सलुट छ रबि सर्tuliptulipसुपर नेपालको हिरो प्रेन्चिस किङ्ग रबि सर,0
जय नेपाल्tuliptulip,0
जब सम्म संसद हरू मन्त्री प्रधानमन्त्री हुन पाउने व्यवस्था अन्त्ये हुँदैन यस्तै हुन्छ नेपाल मा  अब को बिकल्प right to reject अनी right to recall र जनता बाट प्रतक्ष्य निर्वाचित कार्यकारी प्रणाली बाहेक अर्को कुनै विकल्प छैन  जय नेपाल ,0
ईन्डियाबाट आएका इन्डियनले नेपाल आएको 5 वर्षमा  नागरिकता पाउने तर नेपालमा जन्मीहुर्की गरेकी नेपालीले चाहीं आमा बाबुको नागरिकता देखाउंदा प्रणाम चाहिने के हो नेपालको कानुन म प्रश्नगर्छु  ,0
छिटो भन्दा छिटो १ मिलियन subscribed पुराउ galaxy 4k,0
जन्मसिद्ध नागरिकका सन्तानहरूको पनि यस्तै समस्या छ  रवि सर,0
अत्यन्त दुःख लाग्यो,0
सि डि यो सहेको खल्ति भरेको भये नागरिकता मिल्ने थियो ,0
सलाम छ रवि सरलाईरातरात भारतियलाई नागरिकता चाहिँ बाँड्ने तर यी नेपाली चेलीलाई किन नागरिकता नदिने आवज उठौ गाईज,0
राम्रो सुझाव हो प्रचन्ड लाईअब नि नसुधरिए सक्किए राता मान्छे हरुमौका दिएको छ इतिहास मा नाम लेख्न लाई अब सपूत भनेर लेखाउने कि कपुत भनेर लेखाउने जिम्मा उसैको folded_handsfolded_hands,0
आजा हल्का छिटो हेर्न आइयो रवि सर आजा नयाँ सुट्भुट्मा धेरै सुहाएको छ हजुर लाइfolded_handsfolded_handsfolded_handsfolded_handsfolded_handsfolded_handsfolded_handsfolded_handsfolded_hands,0
नागरिताको सम्स्या मैले पनि भोगेकोछुयो बैनिको समस्यादेखेर आफ्ना ती दिन हरु याद आयधिकारछ त्यो बाउ भनौदो लाई ,0
यि नानीले नागरीक्ता पाउँनैपर्छ छिटो भन्दा छिटो मिलोस स्थानिय देखि केन्द्र सम्मका सरकारहरु हो नागरीक्ताको लागि किन दुख दिईरहेको चाँडो देउ,0
भारती लाई दिन मिल्ने नेपाली लाई किन नमिल्ने सिदियो साब  किन पैसा नपायर कि दरले हो  यस्को जानकारी पाउनु पर्यो रबि सर,0
अबिन्ता राउत बहिनी ले  छिटो भन्दा छिटो न्याय पाओस् समस्या आउँछ तर समाधान नै नहुने गरि  कहिले आउँदैन,0
मैले मेरो छोराको नागरिकता बनाउनपनि यी नानुलेभन्दा बढी दर्दनाक अबस्था भोगेको छु यो त प्रतिनिधि घटना मात्र हो,0
प्रत्यक्ष भोटबाट प्रधानमन्त्री चुन्ने ब्यबस्था नआउँदा सम्म नेपालमा जुन पार्टीको नेता प्रधानमन्त्री भए पनि केहि हुने वाला छैन ,0
नाता प्रमाणीत गरिपाँउ भनी मुद्दा लगाउन मिल्छ होला नि र प्रमाणको निम्ति dna test गर्दा दुधको दूध पानीको पानी छुट्टिन्छ,0
सरकार अविन्ता राउतहरूलाई नागरिकता देहार्दिक श्रद्धाञ्जली रबिन्ताको बाउ,0
नमस्कार रबि सर धेरै धन्यवाद छ हजुर लाई जनताको मन सधैंभरि जित्नु हस्,0
रबि दाइको एउटा शोच अनि खोज निकै नै उत्कृष्ट लाग्छ मलाइ नेपालि जन्ता को सान अनि ढुक्ढुकि न्यानो न्यानो दस औला जोल्डेर folded_handsसबैमाtwo_heartsfolded_hands,0
हैट अबिन्ताको कथा सुनेर आँसु नै आयो कस्तो पापी बाउ रहेछ यस्तो अपराधी पनि हुदो रहेछ यो धर्तिमा यस्ता अपराधी त यश धर्तिको बोझ नै हो,0
कस्तो घृणित मान्छे रहेछ अभिन्ता बहिनि को बाउ भनौंदो आफ्नै रगत लाई चिन्दिन भन्ने यसलाई छोरिको आँसुले पोल्ने छ् सरकार यो बहिनि लाई नागरिक्ता दिलाएर त्यसलाई कार्बाही गर,0
देश तथा विदेश बाट सिधा कुरा नछुटाई हेर्नुहुने सम्पुर्ण दर्शक महानुभाव हरु आउनुहोस हामी सग जोडीनुहोस धन्यवाद अहिले कतार देखि हेर्दैछु,0
सुरु को5मिनेट चाहिँ कडा होके,0
हाम्रो रबि दाजु कोred_heartred_heartred_heartred_heart,0
यो नागरिता भन्ने चिज सहजै पाउने वातावरण वनाउन पर्यो सरकार आफ्नो अधिकार लिनलाई आखावाट आसु बगाउन नपर्योस सरकार,0
बाबा आमा बिनाको जीवन जिउनुको पीडा कति  पीडा हुन्छ भन्ने कुरा मैले पनि भोगेको छु बहिनीको कुराले साह्रै मन दुख्यो संबन्धित नियायले यो बहिनीलाई सहयोग गरि नागरिता दिने ब्यवस्था गरोस हाम्रो अनुरोध,0
माहाकसम आँसु नै थामिएन पीडा के हो बल्ल थाहा हुँदै छ,0
सुरुवातमा नै कडा  आयाे  रवि  दाई,0
बिदेश बाट आउने युबाको १ बोतल रौसी र ५०ग्राम सुनमा अबरोध नगर ,0
रहर त मेरोपनि नभाकोकहां होर,0
नेताहरु पाल्नु परेकाे छ गाह्रो छ रबि दाई,0
किन यति दुख दिएको होला जब बाबू ले मेरो छोरी होइन भन्छ भने संविधानले आमाको नाम मा नागरित्ता दिन किन नमिल्ने होला,0
एउटा पनि एपिसोड न छुटाइ हेर्नेहरु हाजिर गरुम raised_hand,0
बिचारा अभिन्ता राउत लाई नागरिक्ता मिलोस सरकारfolded_hands,0
आमाको नाममा नागरिकता दिने कि नदिने बलात्कार बापत जन्मिएको छोराछोरीले पनि बलात्कारिलाई बाउ स्वीकार नगरि केही हुदैन नेपालमा,0
आमाको नागरिकता भए त्यसैलाई आधार बनाएर नभए आमाको सनाखत मा आमाको नाम उल्लेख गरेर बाबुको नाम उल्लेख नगरी भए पनि नेपालमा जन्मेको नेपाली नागरिकले नागरिकता पाउन पर्यो र दिन सहज हुने तरिका अपनाएर दिनु पर्यो,0
हैन तपाईंको तर्क के छ आज भोलि mcc को पहिले सिधा कुरा जनता संग हुदा धेरै कराउँदै हुन्नथ्यो आज भोलि कतै एक शब्द आउदैन किन  रबि सर तपाईंको कामलाई सलाम छ  तर mcc को कुरा उठाउनु  होला,0
बाहुनै किन चाहियो आमा नेपाली भए पछी आमाको नेपाली नागरिकता पनि छ भने किन उहाँको सन्तानले नागरिकता पाउदैन ,0
तपाईंको बाबा कुन पार्टीमा आबद्ध हुनुहुन्छ बहीनी यो पत्ता लगाउनोस् तपाईंको नागरिकत्ता बनाउने एउटा उपाय यो पनि छ,0
एक घण्टा भैसक्यो कुरेको नहेरी पनि बस्न सक्दिन  अलि छिटो हाल्नु पर्यो के रबि दाई thinking_face,0
जय होस hold टिम लाईred_heartred_heartfolded_handsfolded_hands,0
रबि दाइ नमस्कार folded_handsfolded_hands हजुर को बारेमा यो अभियन्ता समाजसेवी भनिनेहेम थापा ले हजुर को  कार्य शैलि प्रति  धेरै नकरात्मक टिप्पणी गरेका छन् यस्को बास्तबिकता के हो रबि म सँग टेबल टक  वहस गर्न डराएको छन् भन्छयो बिषयमा केही बोल्नुस्folded_handsfolded_handsfolded_handsfolded_handsheart_suit,0
आमा छ भने नागरिकता दीनु पर्छ यो सरकार को गल्ती छ,0
आफ्नो छोरीलाई नागरिकता नदिने नेता के देश बनाउनला यस्ता राछेस लाई जिउदैँ जलाइउनू प्रछ,0
कृपया  रबि दाई  श्रीप्रसाद्को  photo उपलब्ध  गराउन पार्यो  kitchen_knifekitchen_knife,0
जनताको पिर मर्का बुज्ने समाधान गर्ने कारिक्रमलाई सलाम धन्यवाद  folded_handsfolded_handsfolded_handsthumbs_upthumbs_upheart_suitheart_suit,0
रबी दाई को सीधा कुरा नहेरे सम्म निद्रा नै  नलाग्ने को को हुनुहुन्छred_heart,0
हेम थापाले सारै गरेकाे छ एक पटक टेबल टक गर्नु पर्ने भयाे रबि जि,0
अति नै मन छुने जिवन को यथार्त चित्रण उहाँहरुको अधिकार लाइ सुनिचित गरौ सरकार,0
आमाको नामबाट पनि नागरिकता दिन मिल्छ भन्छन त  कस्तो कानुन हो नेपालको ,0
ठिक हो प्रचण्डले ५ हजार मात्रैको जिम्मेवारी लिएर हुदैन पुरै १७ हजारको जिम्मा लिनुपर्छ raised_fistraised_fist,0
आफ्नै देशको नागरिकले नगरिकता न पाउदा सार्है दुख लागेको छ  सबैको ध्यानाकर्षण भै तु नागरिकता उपलब्ध गराई दिन सहयोग गरौthumbs_upthumbs_upthumbs_upfolded_handsfolded_hands,0
पहिलो कमेन्ट गर्नेमा परे आज red_heartfolded_hands,0
नेता भने पछि कट्टु मुत्ने थुक्क नेपालको सिस्टम pouting_facepouting_facepouting_face कहाँ छ त्यो मुजी पापी कथालो समाएर घिसार्दै कानुनी कटघारा मा उभ्याउनु पर्छ pouting_facepouting_facepouting_face,0
म येक रास्ट्रसेवक नाताले रबि दाइ माथी उच्च सम्मान तर रबि सर नेपाल पुलिसको बर्दी लगाको दस बर्ष भैसको पोइसा बचत हुन्न परिवार धान्न गारो हुन्छ यो बिसय उठाउनु होस्न जयेनेपाल,0
अबिन्ता लाई नागरिता दिनु सरकारको दायित्व होआज सम्म सरकारले यो कुरा थाहा पायको थियन भने यहि समाचार लाई आधार मानेर तुरुन्त नागरिकता दिइयोस,0
दमदार प्रस्तुति रबि सर नमन छ्folded_handsfolded_handsfolded_handsfolded_handsred_heartred_heartred_heartred_heartred_heart,0
दाजी हेम थापा भन्ने मानिसले तथानाम भन्दै हिड्दै छ त  कुरा के हो ,0
वा नेपाल सरकार भारतिय नागरिक लाई भए त दिन्थो होला त आफ्नै नेपाली नागरिक लाई नागरिक्ता दिन के हेरेर बसेको छ,0
अबिन्ता राउत विषयक कार्यक्रम ले म पनि रोय उहाँ जस्तै धेरै नागरिक ले देसमा न्याय पाउनुपर्छ ,0
रभी सर एक पटक हजुरको मित्रदाजु हेम थापाले तपाईलाई लगाएको आरोप के हो पुस्टि पार्नुहोला प्लीज,0
जय सिधा कुरा जय नेपाल जय ग्यालेक्सी फोर के,0
रबि सर यो काम हजुरले मात्र गर्न सक्नु हुन्छ,0
अविन्नता ले परिचयपत्र पाउन पर्छ,0
नमस्ते folded_hands रवि दाइ लगाएत सम्पूर्ण galaxy 4k परिवार लाइ मेरो घर कपिलवस्तु जिल्ला शिवराज नगरपालिका १मा पर्छ त्यस नगरपालिका मा रहेको मालपोत कार्यालयमा पनि एक पटक जानु पर्यो galaxy टिम  हालत त्यस्तै छ,0
निकै नराम्रो लाग्यो नागरिता अहिले सम्म नपाउँदा,0
दुनिया ईन्डियनहरुलाई चेइ केइ नबोली नागरिकता दिदा मिल्छ  अनि एउटि नेपाली चेलीलाई चेइ नागरिकता दिनु किन मरेको हाम्रो खाते सरकारpouting_facepouting_facepouting_facepouting_face,0
आमाको नाम मा पाउने भन्छ नागरिकता दिदैन लाग्छ यो देशमा पावर वालाको मात्र जे नि हुन्छ नागरिकता पाउनु पर्छ सम्बन्धित निकायको ध्यानाकर्षण होस,0
लौ सुरु गरियो अब दुबई बाट  सुरुको १ मिनेट र अन्तिम को १ मिनेट त म्युजिक बजेर नै सकिन्छ यसलाई सुधार गर्नु पर्यो साथै समय पनि केही बढाउनु पर्यो ,0
backhand_index_pointing_leftधेरै नै राम्रो छ प्रस्तुती रवि लामिछाने सर ok_hand,0
दुख लाग्यो,0
सत्य र उपयोगी योग्री कार्यक्रम smiling_face_with_hearteyessmiling_face_with_hearteyes सिधा कुरा,0
सरकार पिडित लाई न्याय देfolded_handsfolded_hands,0
न्याय पाउन नेपालि जनता यसरि कहिलेसम्म मिडियामा धाउने हामीले न्याय पाउन अब कुन व्यवस्था र राजनिती नेपालमा आउनुपर्ने हो,0
यो कार्यक्रम नहेरी नीद पनी लाग्दीन सम्पुणमा folded_handsfolded_handsfolded_handsfolded_hands रबी सर हाम्रो पाल्पा जील्लाको तीनाऊ 1 गाऊ पालीका मा पनी हेर्नु पर्यो हर सबैमा लापर बाई भयको छ पील्ज folded_hands10औला जोडि जसरी भयनी रिपट देख्न पाम,0
रवि दाईको नाकको दारी भाच्ने डाइलोक क_कसलाई मन पर्छ,0
जय नेपाल रवि दाई,0
अगाडिको प्रस्तुति राम्रो लग्यो ,0
