text,label
बजार ले जसरी ट्रेन्ड चेन्ज गर्यो यो हेर्दा तत्काल प्रोफिट बूकिङ आउने सम्भावना रहेन  भोलि अर्को ट्रेन्ड समात्न सक्ने अबस्था पनि दरो छ,2
1000 अंकले घटेको नेप्से 200 अंकले बढ्नु ठूलो कुरो होइन अझै पनि किन्ने अवसर छ है,1
होइन यो सानिमा बैंक ले bonus घोसणा गरेको २ महिना भयो book close  अहिले सम्म खातामा आउदैन त  ब्याज संग दिने योजना रहेछ कि क्या हो,2
खैँ mbjc प्रति कित्तामा रू10ले बढेर आज रू1100 मात्र भयो 10कित्ताको ,2
राम्रो भयो,1
मध्यभोटेकोशिको शेयर  कर्मचारी संञ्चयकोष का संञ्चयकर्ताहरुको नाममा परेको शेयर कहिले मेरो शेयरमा देखाउँछ होला  प्रष्ट पारिदिनु होला ,2
जानकारीको लागि धन्यवाद रामहरी ब्रदर,1
हाईड्रो र फाइनान्स बुम बुम भन्न छोडिएछ त ,2
profit booking ले यत्रो अङ्कको गिरावट त नआउनु पर्ने केहि हदसम्म प्यानीक नै देखियो अझ पनि लगानीकर्ताहरू विश्वस्त देखिएन फेरि पनि प्यानीक आउने सम्भावना देखियो,2
फेरि भर्चुअल मिटिङ कहिले हुन्छ दाजु हजुर जानकारी गराउनुस् है,2
२५०० क्रस नगर्ने भयो सरहाई क्याप वाला सबै घट्यो हेर्दा हेर्दौ अलि अलि फाइदा भएको पनि लाष्टमा लस नै भयो,2
हो हो सर,2
सगोत्री बन्दु स्वास्थ को ख्याल गर्नु होला,2
यो एनलाइसिस्को एडिक्ट पो भै सकिए छनसुनी चितै मान्दैन,2
आज देखि मैले पहिले चोटि secondary बाट कारोबार गरेको आजै 4300 चुना लाग्यो,2
sir  ntc मा लामो समय लगानीगर्दा कस्तो होला  बताइ दिनु न ,2
मानौ मैले कुनै कम्पनी बुक क्लोज भन्दा 1 दिनअघि किने र प्राइज एडजस्मेन्ट पछि बोनस प्राप्त नगर्दै  बेचे  उक्त कम्पनी बेचिसकेपछि मैले बोनस सेयर प्राप्त गर्छु कि गर्दिन  गरेमा कति समयमा आउँछ,2
७० करोड घुस प्रकरणमा यसरी रिसाए गोकुल बाँस्कोटा गगन र विश्वप्रकाशलाई कालापानी जान चुनौति,2
भारतमधेस र नेपालचीन सम्बन्ध विग्रन्छ मधेसी नेता अरू दलको भरिया  डाराजेश अहिराज,0
भीम रावलको खुलासा  एमाले छोडेर नयाँ दल खोल्ने एमसीसी पढ्न देउवालाई आग्रह पारित गरे दुर्घटना,2
राजनीतिक स्वार्थ र लहडमा जथाभावी विमानस्थल बनाउने होड  galaxy news report,2
प्रचण्डले खुमलटार छोड्दैः पैदल हिँड्ने झुपडीमा डेरा सर्ने  prachanda  yaksha prashna,2
दुर्गा प्रसाईको घोषणा  भीम रावलले एमाले छोड्ने ओली महामानव देउवा प्रचण्ड र माधबको भण्डाफोर,2
कांग्रेस नेता मिनेन्द्र रिजाललाई यक्ष प्रश्नः सक्रिय राजनीतिबाट विश्राम लिएको हो dr minendra rijal,2
प्रधानमन्त्रीलाई अब ठूला भ्रष्टाचारको फाईल खोल्न लगाउँछु  ap center  ap1hd,2
लेखनाथ न्यौपानेको खुलासामहाधिबेशनमा एमसीसीको कुरा गर्नेलाई जुत्ताको माला लगाएर कालो मोसो दलिन्छ ,0
mcc bahas  एमसिसी सन्देह संवाद र समाधान  ap1hd,2
प्रचण्डलाई यक्ष प्रश्न  देउवाको ज्योतिषी को  छबीलाल हो ,2
जे गरेपनि एमसीसीले संकट निम्ताउने देखियो  gebate with nimesh banjade  surendra pandey  ep 47,0
अर्थमन्त्री शर्माको खुलासाएमसीसी सहमतिमा पारितदेउवा प्रचण्ड गठबन्धन निरन्तरमाओवादीमा परिवर्तन,2
प्रचण्डको सनसनीपूर्ण खुलासा माधव बाबुराम बैद्य र विप्लवसहितको नयाँ पार्टी बनाउने,2
धुर्मुस र रविलाई गाली गरेर थाकेनन् हेम थापा  glamour guff  epi 65  prakash subedi  hem thapa,2
सीपी गजुरेलको खुलासा प्रचण्डसँग एकताका लागि यस्तो छ प्रस्ताव बैद्य बाबुराम र बिप्लवले के गर्लान ,2
ओलीसँग अध्यक्षमा पराजित भएका भीम रावलको पहिलो अन्तरवार्ता पार्टीभित्र यो हदसम्मको षड्यन्त्र भयो ,2
यो भ्रस्टाचारि लाई किन येति घमण्ड  ७० करोड को पर्दाफास हुदा नि येति धेरै आत्मबल्pouting_face,0
गोकुले   भन्न बितिकै ७० करोड को मात्र  याद आउँछ७० करोड  ७० करोड,2
backhand_index_pointing_right ७० करोडको अझै कति धेरै चुरिफुरी छ थुक्क हाम्रो देशका नैतिकता नभका चोर नेताहरू angry_faceangry_face,0
किन ल्याको यसलाई  सत्तरी करोडको अनुहार देख्न पनि मन छैन,2
जसले जे सुकै भनेपनि गोकुल बास्कोटा  काभ्रेको बाद्साह हुनraised_fistraised_fistraised_fist,1
यो मान्छेको थोप्डा देख्यो कि खोपडी गरम हुने म मात्र होला कि के हो,0
यस्ता भ्रष्टहरुलाई रोजेर पठाउने हामी जनता कस्ता भन्या,2
कति चुरिफुरी यस्को ,2
औषधिमा भ्रष्टाचार गर्ने यो महा पापी हो,0
म यहाँ dislike गर्न र यो मान्छेलाई बहिस्कार गर्न मात्र आएको हो येस्ता भ्रस्टाचारी नेताहरु सबैलाई सामाजिक संजालबाट सधैको लागि  बहिस्कार गरओ,0
गोकुलजीले भनिसके त  भ्रस्टाचार गरेको रहेछ भने भन्नेहरुकै सबथोक छ छानबिन गरि प्रमाणिात गरेर देखाए भइहाल्यो नि,1
के बोलेको होला यो 70 ले संसद विगठन नै यो अवस्थाको जड हो भन्ने किन बिर्सेकाे,2
स्वच्छ र असल राजनीति गरौं ,1
समृद्ध नेपाल निर्माण गरौं ,1
mcc अब पास हुन्छ त्यो पनि गठबन्धन जोगाउनको निमित्तangry_facepouting_face,2
भ्रष्टाचारिलाई किन अन्तरबार्ता लिएको होला,0
चोरले म चोर हुँ कदापि भन्दैन लाज पचेको ७० करोड वलिको पुच्छरको चुरिफुरी देख्दा उदेक लाग्छ,0
विना स्वार्थ लोभ लालच सबै कम्युनिस्ट एकता जरुरी छ देशका लागि,1
गोकुल काकालाई मान्नैपर्छ बा ७० करोडको टेप नक्कली रे दिउसै रात पार्ने मान्छेहरुको नै बोलबाल छ देशमा कति लाजै नमानी भन्न सकेको हो भने,0
७० करोड चोर i आफु चोर होइन भने किन राजिनामा सुरुक्क देको त्  माग्ने बेलामा ७० करोड माग्ने चोर अईले आएर नकली भोइस हो रे i,0
नेपाली समाज हुइयाॅको पछाडी दौडने समाजबाट कहिले माथि उठ्ने होला,0
70 करोड कता कता लगानी गर्नु भयो जानकारी पाईन्छकी,2
यिनले  प्रश्न उठे पछी राजिनामा दियो रे नैतिकता देखायो साची नै यिनी सहि रहेछन् भने यिनका के पि ले नैतिक्ता बेचेकै रहेछ भन्ने कुरो यिनैले प्रमानित गरेछन्् ,0
धन्यवाद folded_hands,1
100 खाकोई हो 70 करोड छाती थोकेर भन्छु   किनकी खाली पुस्ती गर पुस्ती गर भन्छ,0
70 करोडको दम्ब अझै हेर्नु pouting_facepouting_facepouting_facepouting_face कुन नेपाली जनताको कुरा तिमीहरूको भुस्सेहरु नेपाली जनताहरु होइन,0
अाफु पदमा हुदा नियम कानुन अनुसासन नचाहिने अरूमा हुनु पर्ने साला गाेरू,0
हिजो दुइ तिहाइ को घमण्ड गर्नेको बाहिरिय पछीको रोदन हो  बिचरा यो उखाने पार्टी ले केहि गर्नु सकेन अहिले अरुले गर्दछु भन्दा रोक्ने सहयोग नगर्ने अनि कसरी हुनछ देशमा बिकास  अहिले अाएर ठिक लाग्यो सहि हो धमला सर ,0
यो देस बाट सम्सोदिय ब्यबस्था नै खारेज गर्नु जरुरी छ  हैन भने देस को हालत सधै यस्तै रहन्छ ,0
नैतिकता हराएको मान्छे,0
जसले जे भनोस गोकुले काका राम्रो नेता हुन्,1
रिसाउने मात्रै होइन कुट्न पर्ने हो यदि घोटाला नै गर्या भए कारबाही गरे भैगो नत्र बारम्बार टचर कस्ले सहन्छ,0
एक पटक गोकुल बास्कोटा र ज्ञानेन्द्र शाही बिच छलफल गर्नुपर्ने भो ऋषिजी,2
हाजिरी जवाफ मा आको होइन रिसि जि rolling_on_the_floor_laughingrolling_on_the_floor_laughingrolling_on_the_floor_laughing,2
माननीय ज्यु बोलिमा परिवर्तन हुनुपर्छ,1
mccल्याए भाे भन्ने हाेईन  mccलाै लेराअाे त  भन्ने हाे देश र जनताकाे हित हुदैन भन्ने थाहा भाे mccकाम रैनछ भन्ने हाे खबरदार mcc पास हुन दिने हाेईन ,2
७०कराेड ताेपकाे सलामि छ बाेर्राे,1
यस्तै नेतालाई हो नि चोर आयो भन्ने गाउँ घर तिर,0
राजेन्द्र लिङ्देलले भने जस्तै,2
सत्तरी करोडौंको सन्दर्भमा ऋषि धमलाले सत्र पटक सोधिएको देखें धमलालाई मेरो प्रश्न हिजो सरकार बाहिर हुँदा बिरोध गर्नेहरु अहिले सरकारमा छ किन छानबिन नगरेको भनेर सोध्ने किकाण्डहरु किन छानबिन  नगरेको कहिले गर्ने भनेर र्याखर्याकी पर्ने कि,2
mcc नेपालीको  लागि रामराे हाे ,1
सहि हो कुरा,1
प्रचण्ड देशका रोग नै हुन ,0
के ७० करोड भन्छौ नालायक हो तेस्ता किलिप्स प्रसारण गर्ने पत्रुकार ऐले नेपाली काङ्ग्रेस को केन्द्रिय सदस्य भको छ साला सब चुतिया हुन,0
सबै भन्दा खराब नेता गोकुल हुन,0
सबै भन्दा पहिले  कानुन् मिचेर ७० करोड को भ्रष्टचार  गर्ने गोकुल बास्कोटा ले राजिनामा दिनु पर्छ,2
यो चोर लाई देख्यो त दिमाग तातियेर आउछ pouting_facepouting_facepouting_face,0
जबरजस्तीको कुरा गर्छ यार ,0
यस्ता वहियात नेतालाइ ल्यार किन समय खेर फाल्नु हुन्छ धमला जिछि छि,0
याे गाेकुलेलाई हराउनुपर्छ,0
जति सकिन्छ सफाई दिउँ ,1
प्रस्न गर्नै जान्दैन हो यो धमला जी ले,0
चोरको अन्तर्वार्ता आएछ ७० करोड चोर भुसडीgrinning_face_with_smiling_eyes,0
70 कारोड चोरको फेरि आगमन भएको रहेछ म त भन्छु गोकुल चोर देश छोड,0
बुडो गोरु जठौ  भीरमा जाऊ  थुक्क मेरो देशको नेता लाज पचेका बिदेशी डलरबादी देश पुरै धरशयमा पारिसक्यो ,0
जेजे भए पनि यो मान्छे को कुरा सुन्दा मजा आउछ ,1
क्या दिन्छ गोकुले ब्रो seenoevil_monkeyseenoevil_monkey,2
यो 70 करोड गोकुले ओलीले गर्दा खुप चुरी फुरी गरिरहेको छ लाज सरम नभएको,0
काभ्रेका बादसाह एमालेको ताकत गोकुल दाइको कुरा सुन्न मजा आउछ,1
७० करोड ले अलि बढी गफ दिन्छ,2
70 करोड भ्रष्टाचारि केपि को पुच्छर,0
जस्ले जति सुकै भनेनि गाेकुल बमस्काेटालाई मैले माने,1
होइन यो उखाने को छोरो हो भन्दैमा 70 करोड वाला गोकुले ले पनि हसाउनु पर्ने हो र हिजो उसको पार्टी हुदा सबै ठिक गरेको रे अहिले बाहिरिय पछि यो सरकार ले केहि गर्न सकेना रे कति हास्नु हो अब त तिमीहरु perfect thumbs_up भैसकेछ साप्ताहिक उखान टुक्का कारेक्रम चलाउदा हुन्छ all the best thumbs_upclapping_hands,2
जस्तो गुरु त्यस्तै चेला,2
गोकुल  जि ले गर्नु हुन्छ,2
मर्ने बेलामा लामो सास फेर्छ तेस्तै होला नि झुम्रेड,2
70 करोड पनि नक्कली हो भन न ,2
यो चोरलाइ किन घरीघरी अन्तरबार्ताको लागि बोलाउछौ धमला बुढा,2
७० करोडलाई बोल्न पनि लाज लाग्दै बा,0
७० करोड धिक्कार तिम्रो विचार मुर्दावाद,0
आमा को कुरा मामा संग नगर्नुस् न धमला जी,2
यो रिशी धमलालाई लाजै छैन यार 1000 पटक राजेन्द्र लिङ्देललाई ल्याउ न यार अरु नेताहरुलाई नल्याउ के यार दाइ,0
छिछिछिछि यस्तो नालायक लाई पनि के ल्याएकाे हाेला यार हेर्ने लाई पनि दिक्क  खै ७० कराेड कता गयाे  याे ले पनि के माधवकुमार शीत दाज्न मिल्छ ऋषि सरले पनि यस्तो लाई ल्याएर अाफ्नाे खुट्टामा अाफै बन्चरो हान्दै हुनुहुन्छ है,1
गोकुल को राज निति चहि कता,1
70 करोडको चुरीफुरी यत्रो ,1
सब थोक गाली गर्छन् अहीले भोली आन्द्रा जोडछन् मुलाहरु,1
गोकुल बा ले आज चाहि यो हावा धमला को सातो खायो,1
गोकुलेको पर्यायवाची सत्तरी करोड rolling_on_the_floor_laughingrolling_on_the_floor_laughing,2
मान्छे कोल्याप्स गदिनु परो,0
यो गाउँको ठिट्टो म,2
दलाल भगाउ देश बचाउ,0
70करोड त बाहिर आयो अझ यिनले कति खायो होला,2
यो नालायक ७० करोड कता बाट आयो,0
यो भतुवा 70 करोडलाई किन बेला बेला मा बोलाउछन मिडिया मा,0
सहि कुरा,0
मलाई पनि चाईयो बोरा बोरा पैसा rolling_on_the_floor_laughingrolling_on_the_floor_laughing,2
ए मा ले को चुनाव चिन्न्ह गोकुल बास्कोटा,2
70 करोडले ठुलो ठुलो कुरो गर्दै छ त,2
चोरै हो ,0
भरष्ट चारिका खलक हरु कति चुनाब चुनाब भनेको हो,0
डलर सन्चितित 70 मा भा छ,2
हेरौला रे grinning_face_with_smiling_eyesgrinning_face_with_smiling_eyesgrinning_face_with_smiling_eyesgrinning_face_with_smiling_eyesgrinning_face_with_smiling_eyesgrinning_face_with_smiling_eyesgrinning_face_with_smiling_eyesक्मेदी च्याम्पियन को जज मनोज सर ले यो सुनेर कमेन्ट गर्नु भोकरोड 70 करोड त्यस पछि मेरो जो चोर उसैको ठुलो सोरइनि भन्दा ठुलो चोर को होला लाज सरम भन्ने छैन अझ ठुलो कुरा गर्छ जनताले मलाइ के भन्छ्न भन्ने पनि नहुनेgrinning_face_with_smiling_eyesgrinning_face_with_smiling_eyesचुनाब जित्ने रे थु,2
स्वदेशी बिदेसी छदमबेसी न सकिने भयो कडा,2
70 carod खाएर ठूलो कुरा गर्छ,2
भ्रष्टाचारि डाका,0
70 करोड डाका काई को,0
नक्कली टेप face_with_tears_of_joyface_with_tears_of_joyface_with_tears_of_joy,2
जो चोर उसैको ठुलो सोर चुतिया ७० करोड,0
बोल्न चै निडर नेता हो गोकुल बास्कोटा ज्यु ,2
फेरि यसको बर्वरोट सुरु भयो smiling_face_with_open_mouth__cold_sweatsmiling_face_with_open_mouth__cold_sweatsmiling_face_with_open_mouth__cold_sweatsmiling_face_with_open_mouth__cold_sweatsmiling_face_with_open_mouth__cold_sweat,0
70 करोड वाला अझ कति चुरिफुरी गर्छ थुक्क,2
७० करोड बाडौ न सोल्टि,2
रा प्र पा संग सह यात्रा गर्छ एमाले ले,2
70 पछि अरु कति हो अब केही समय रोकिएकोमा किन रिसाउनु हुन्छ नेता ज्यु,2
चोर आयो ,0
लाज सरम छैन चोर लाई,0
गकुल 70  खरब चोर हो,0
यो गोकुले को दिमागमा केही समस्या छ जस्तो छ,2
चोर डाका,0
थूक्क यस्ता खुराफाती  खड्केको  हलिहरु लाइ पनि मिडियामा स्थान दिने कोहि नपाएर    खड्केको  हलि  प्रतिगामीको मतियार भएर क्रान्तिकारीसँग जोरी नखोज्,0
तामाङ,2
जनजाति जस्ता अहिलेसम्म दमनमा परेकाहरुलाइ कोटा छुटाउदा गाली गर्नेहरुले क्षमता नभएको मान्छे आउछन् रे तिमीहरूको नियम र कानुनले यस्तै क्षमता भएको मान्छे ल्याउछन,2
पागलपना,2
सन्सार कै पहिलो नकचरो ७० करोड प्रमाण सहित आउदा पनि यति धेरै घमण्ड  भ्रष्ट लाई के सजाय हुनुपर्छ भन्नुस साथी हो ,0
म पनि dislike गर्न मात्र आकी हुं,0
ल हेर यस्को दम्भ,2
यो फटाहा लाई बोलाएर के छलफल गरेको होला,0
हेहेहे पागल साले 70 करोड मुजि यस्लाइ भेट्न् पाए,0
