text,label
रबि बिनाको देश अधुरो र अपुरो हुन्छ ,0
नमस्कार रबि सर लगायत सम्पूर्ण टिम folded_handsfolded_handsfolded_handsfolded_handsfolded_handsfolded_handsfolded_handsfolded_handsfolded_handsred_heartred_heartred_heartred_heartred_heartred_heart,1
galaxy 4k मा यस्तै शिधा कुरा कुरा जस्तै सबै कार्यक्रम हुन आशामा छौ,2
teacher को नाममा यस्तो घिनलाग्दो काम गर्नेलाई जेल  हाल्नुपर्छ,0
पैसा तिरेर आफ्नै बच्चाहरूलाई किन यातना पाउन पठाइरहेका छन अभिभावक हरु,2
यस्ता शिक्षाकको नाममा पशुलाई कडा भन्दा कडा कार्वाहीको  माग गर्दछु thank you so much  rabi sir and sidha kura whole teamfolded_hands,0
धिक्कर हामी जिउदा नेपाली लाई अनि मेरो देश डाको छोडेर रुन मन लाग्छ हाम्रो देश को हालत देख्दा,0
जे हाेस रबि जि ले घुमाउरो पारा ले दिनिहुन्छ दलाल हरुलाइ folded_handsfolded_handsfolded_handsred_heartred_heartred_heartthumbs_upthumbs_upthumbs_up,2
यो टीचर लाई तुरुन्त कार्यबाही गरी स्कूल बाट खारिज गरी निकाल्नु पर्छ र कार्यबाहिको दादरी ल्याउनु पर्छ,0
नेपालको जरुरी भनेको कृषि क्रान्ति  शैक्षिक क्रान्ती  सामाजिक क्रान्ति  आर्थिक क्रान्ति  राजनैतिक क्रान्ति  जरुरी छ  सबै भन्दा ठुलो समस्या भनेको धार्मिक क्रान्ति  हो  ,2
दुबैको सडक मा सुत्नु पर्ने सबै नेपाली हरु मुलबासी मङ्गोल हरु हुन  सामाजिक क्रान्ति क्रान्तिको जरुरि भएको नमुना यहि हो,2
रबि दाइ को कार्यक्रम नहेरी निद्रा त फिटिकै लागेन त मलाई ribidai folded_hands,2
7 मिनेट को रबि दाईको आवाज दमदार छfolded_handsfolded_handswilted_flowerwilted_flowertwo_heartstwo_hearts,1
रबि दाइ को डालेक खुब मन पर्छ clapping_handsclapping_handsclapping_hands,1
रबि दाई को सबैले सम्मान गरौ हातमा हात र काधमा काध मिलायर अघि बढौ 5सालमा हाम्रो देसको मुहार फेर्न सकिन्छ,1
नमस्कार रवि जी सहित पुरा टिम लाइ folded_handsfolded_handsfolded_handsthumbs_upperson_raising_hand,2
सहि हो सहि रबि सर हामी त बिदेशमा छम् दादा मनमा घर परियार र देशको चिन्तामा तर हेर चोरहरु चोरेरै परियार पालेका छन् देश बनाउछन् रे यस्ताले अनि आस पनि कस्तालाइ गर्छन् हो,2
अब बन्ने मन्त्रिमण्डल चै खतरै रहेछ रबि दाईको अड्कल,1
रवि लामिछाने जिन्दावाद जय सिधा कुरा ,1
रबि सर हजुरकाे ७ मिनेट कार्यक्रम काे बाेलि गाेलि जस्तै भाकाे छ thumbs_up,1
सर्वप्रथम रवी सर लाई नमस्कार यो कार्यक्रम मार्फत सम्पूर्ण असाय दुखी पीडित र गरीब को मुहार मा न्याय को आस दिलाएका र दुखी पीडित को घाउ मा मलम पट्टि लगाइ दिएका छ्नहे भगवान हाम्रो देश मा कहिले सुख शान्ति र गरीब ले न्याय पाउलान,1
clapping_handsfolded_handsbouquetसिधा कुरा कार्यक्रम अब ट्रेन्डिङ १ मा लेराउनु पर्यो दर्सक स्रोता ज्यु हरु यो सब तपाईं हरुकै हातमा छ  लाइक सेयर र सस्क्राइब पनि गर्नु यो यो नेपाली जनताको  लोकप्रिय कार्यक्रम हो है यो folded_hands,2
निशब्द बनाउछ्न रबि दाइलेrevolving_heartsrevolving_hearts,1
शिक्षा दिन्छु भन्नी नै नलाएक छ कसरी बिध्यार्थी ले शिक्षा पाउछ,0
म दलाल होईन नै भन्छन् दलाल हरु pouting_face दलाल हरु को संजाल नै हुन्छ  सोझासाझा मान्छे हरु लाई ठगेर कतिञ्जेल सुख र शान्ति हुन्छ oncoming_fistpouting_face,0
यस्ता टिचर लाई पनि नाङ्गो पारेर सबै को अगाडि घुमाउनु पर्छ माफी माग्दा नपाउने गल्ती हो यो बालबालिका को हक अधिकार यही हो,0
गाउँ गाउँ बाट कार्यकर्ता नै लखेट्ने अभियान गरौ अनि सुध्रिन सकिन्छ किface_with_rolling_eyesरबि दाइ लाई जिम्मा दिनुपर्छ leader को,0
दमदार कार्यक्रम सिधाकुरा रवि दाजुको साथमा हेर्ने जति यता हाजिरी हौत folded_hands,2
आजको रबिदाइको डाइलोग चै कडा आयो,1
अब जनताले  भोट हाल्दा चुनाब चिन्ह परिवर्तन नगरे भोलि भोग्ने यहि हो ,2
रबी दाई आजको सुरुवात चाई दमदार नै आयो है  im agree with you smiling_face_with_hearteyesgrinning_face_with_smiling_eyes,1
रबि दाइ तपाइँको news नसुन्दा निद्रा नै लाग्दैन,2
यो देस बनाउन रबि सर जस्तो युवाहरूआउनुपर्छ,2
बल्ल हुन्छ जन्ताको चाहना पूरा ,2
रबि सर लाई सबैले माया गरनु हाेला folded_handsfolded_hands नेपाल ,1
सतिले सरापेको देश नेपाल,0
कहिल्यै पनि राम्रो अभिभावक पायन अझै कति झुर हुनै बाकी छ,0
अहिले प्रस्तुत गरेकाे समचार धेरै  राम्राे छ ,1
यातायातका कार्यलय बाट पाउने सवारि चालक अनुमति पत्र मा बिचउलियाहरु माैलाए यश सम्बन्धमा  समचार बनाउन परेओ ,0
यस्ता घिनलाग्दो ब्यवहार बिद्यार्थीहरु माथि गरिन्छ भने कडा भन्दा कडा कार्वाही हुन आवश्यक छ,0
यसलाई कडा भन्दा कडा सजाय होस भोलि गएर अरूलाई हुँदैन भन्न सकिँदैन,0
रबी को उल्टो वीर हुन्छ,2
त्यही नाम भ्रष्टहरुलाई पित हुन्छ,2
दाइ रक्षा मन्त्री मा दिपक मनाङ्गे हाे भने defense चै बलियाे नै हाेला कि face_with_stuckout_tongue__winking_eyesmiling_face_with_open_mouth__smiling_eyessmiling_face_with_open_mouth__closed_eyessmiling_face_with_open_mouth__cold_sweat  साेचेरै पद बिभाजन गर्नु भए छ  जय हाेस रवि दाइ काेfolded_hands,1
प्राईबेट कलेज खोल्नै नदिनु पर्ने हो सबै नेताहरु को सेटीड् छ,0
दलाल बाट धेरै नेपाली ठगियका छनचोर दलाल हरु लाई फासी या गोलि हानुम,0
बिधार्थीहरुकाे नाङ्गै बनाएर फाेटाे खिच्ने नरपशु शिक्षकलाई  कालाेमाेसाे दलि अगामि दिनमा कुनै सरकारी जागिरमा अयोग्य बनाई खेदाउनु पर्छ,0
folded_handsfolded_handsनमस्कार  रबि  सर  हजुर  लाई  धन्यवाद   छ रबि सर  smiling_face_with_hearteyessmiling_face_with_hearteyesthumbs_upthumbs_upthumbs_upthumbs_upthumbs_upthumbs_upthumbs_upthumbs_up,1
सीधा कुरा जनतासँग सबैको प्रिय प्रोगाम हो,1
जय रबि लामिछाने ,1
अति राम्रो काम गर्नु भएको छ दाई,1
हेर्न सुरु गरे म पनि सिधाकुरा प्रष्ट बिचार folded_hands,2
रवि सर हजूर को कार्यक्रम नहेरी निन्द्रा लाग्दैन भनेयfolded_handsfolded_handsfolded_hands,2
हचुवा तालमा फेसबुकमा भएको पोस्टको आधारमा विस्वास गरेर यसरी पैसा पठाउनु हुदैन  धेरै scammers छन् जसले फेक आईडी बनाएर ठगी रहेको छन्  सबै सतर्क रहनुहोला ,2
रबि सर को दमदर को आवज नसुने त मन नै मानदैन best of luck,2
रबि सर तपाई जस्तो मान्छे चाएको छ हाम्रो देश लाई तपाई आउनु पर्यो राज निति तिर,2
रबि सर उता तारा बराल अनसन बसेको धेरै दिन भयो किन कुरा उथाउनु हुदैन हजुर ले हजुर हिरासदमा हुदा धेरै आवाज उथाउने मा थिन उनी पिलिज उथाइदिनु पर्यो  कुरा,2
माफिया दलाल भ्रष्ट चोर लिडर सबै मिलेका हुन्छन् हजुर  सिधै मन्त्रालयमा गएर भण्डाफोर गरियोस् folded_handsfolded_hands,2
रोकिएन निकुञ्जमा घाँस दाउरा गर्ने काम घाँस दाउरा गएकाका प्रति निकुञ्जका कर्मचारीद्धारा अभद्र व्यवहार रिपोट बनाई दिनु होला रबि सर,0
दामी कार्यक्रम छ  रबि दाइ दमद्दार भनाइलाई सलुट छ,1
सुरुको ५ मिनेट चाही दम्दार नै हुन्छ कडा,1
रबि दाजु अब हजुर आउनु पर्यो नत्र देश खत्तम हुन्छ,2
कडा भन्दा कडा कारवाही होस दुवै मास्टरलाई र यस्ता स्कुलनै बन्द होस folded_handsfolded_hands,0
स्कुल मा पढाउने बिसएहरकोराम्रो शिछकहरु बात बिदिओ बानाएर युटियुबमा हालेर तेस्को प्रचार गरौसबैलेधेरै पैसा नहुने र पढ्न चाहने ले त्यो भिदिओ मार्फत पढ्न पाउन,2
यो सुनिल शर्मा भन्ने जन्तु कुन नेताको बलमा उफृरहेको छ दादागिरी देखाएको छ बोल्ने सौली पनि गुन्डाको जस्तो छ विद्यार्थी लाई बोल्ने शैली धम्किपुर्ण छ,0
दाइको नेत्तिरटोमा देश लाई हेर्ने ठुलो सपना छ,2
रविन्द्र मिश्र को एजेन्डा पारित नभएसम्म नेपालमा गरिब र न्युन स्तरका बिद्यार्थी जनताले शिक्षा र स्वास्थ्य पाउन सक्दैनन्,0
यो mcc को सपोट गर्ने पार्टीहरु लाई सिधै बहिस्कार गरुम  no mcc ,0
यस्तो शिक्षकलाई कार्बाही होसस्कुल बाट नै बहिष्कार गर सरकार,0
बनाइसके देस तराजा आउनैपर्छ देस बनाउनलाइ तइनिहरुलाइ पत्तासाफ पार्नुपर्छकोहि चोर ठिक छैनन,0
अब प्रधानमन्त्री रबि लामिछाने भए मात्रै देश बन्छ,1
कस्तो खाले पिचास शिक्षक रहेछ हदै सम्मको कार्बाही होस सिधा कुरा जनता सगका असलि फ्यान यता है,0
याे पागल शिक्षक लाई कुनै पनि सरकारी वा प्राइभेट जागिरमा  अयोग्य ठहरिने गरि कार्बाही गर्नु पर्छ अनि नेपालकाे कानुन बमोजिम हदैसम्मको कार्बाही हाेस् सरकारलाई अाग्रह,0
यस्ता कलेज बिचाैलिया काे हाे र यसमा सरकारकाे पनि हात छ यिनिहरू मानव हाेइनन्,0
सहि कुरा रबि सर धन्यबाद छ रबि सर,1
राम्रो छ सबै टिम लाई धेरै धन्यवाद,1
कडा कारबाही होस् त्यो शिक्षकलाई,0
नेपाल र नेपालीको हरि बिजोक छआफनो देशमा बसु बेरोजगारको सिकार र राजनीतिक दलालहरुको मिचाइ र बिदेशीनु बाद्य्ता छन् ,0
सलाम छ रबि सर ,1
यो देशमा रवि सर जस्तो यूवा नेताको खाचो छ जय देश जय रवि,1
कांग्रेस का डनहरूले चलाकाे मेडिकल कलेज यस्तै  हुन्छ ,2
यस्ता अपराधिको लिङ्गनै सार्वजानिक स्थानमा काट्ने कानुन बनाउन जरुरी छ,0
देश बनाउनै छ भने पहिला देशमा नयाँ लिडर काे आबसेक्ता छ जब लिडर जन्मेला तब म जस्तै हजारौं युवा भाेट हाल्न नेपाल पुग्छाै   नत्र कागज मा मात्र नेपाल रहन्छ,2
रबिदाई म त नेपालमै छु तर कुनै पार्टिको साथमा छैन तर मेरो देशको बिकाश म पनि चाहान्छुकुनै पार्टिमा लाग्न चाहान्न अनि बिदेश पनि जान चाहान्न,2
जय रबि लामिछाने ,1
नमस्ते रबि सर अहिलेको यो परिवेशमा राजनीतिज्ञ ठिक नभए सम्म देशको हालत जस्ताको तस्तै भइनैरहन्छ तसर्थ अरुलाइ खवरदारि गरिरहने काममा खटिरहेर कति घाटि सुकाइरहने अवत हजुरनै जाग्नु पर्यो देश र जनताको लिडरको नेतृत्वमा पुग्ने यात्राको तय गर्नुपर्यो समग्रमा हामी नेपाली जनता चाहान्छौ हजुर राजनीतिमा अाउनुपर्यो,2
यो मुजि कस्तो मास्टर हो बिद्यार्थीलाई नाङ्गो बनायो भने सकारात्मक सोच आउछ भन्ने   के हुँदै छ हो हाम्रो देश,0
sorry भनेर यो यो दुई जना शिक्षक लाई यसै छोड्नु हुँदैन  यी नालायक हरुलाई नाङ्गो पारेर रोडमा घुमाउनु पर्छ,0
रबि सर अब राजनीति मा आउनुपर्छ,2
रबि सर अनि पुरै टिमलाई  सलुट छ,1
अरु देशमा शिक्षा निशुल्क हुन्छहाम्रो देशमा शिक्षा व्यावसायिक थलो बनेको छके गर्नु सुन्दर देशमा गिद्दे नजर भएको नेताकार्यकर्ता भएपछियो भन्दा बढी नबोलौदिक्दार लाग्छ यस्तो बेथितिको राजनीति देखेर,0
गरोह छ हो रबि दाई लाई  होस्ट गर्न smiling_face_with_open_mouth__cold_sweatsmiling_face_with_open_mouth__cold_sweat anyway good job clapping_hands smiling_face_with_hearteyes rabi is the best,0
नमस्कार रबि सर हजुर लगायत सम्पूर्ण टिमलाई धेरै  धेरै धन्यवाद छfolded_handsfolded_handsfolded_handsbouquetbouquetbouquet,1
mcc नचाहानेहरुको भिंड यो,2
नेपाल मा एकै मात्र सत्य कुरा न्याय पाउने रवि सर को एक मात्र 4k टीवी छ कानुन सबै रवि को हातमा  दिने हो भने सबै ले पाउने न्याय र अन्याय गर्ने को निर्मूल हुने थियो यो ग्यारेन्टी हुन्छ देश र जनता ले खोजेको मान्छे एक मात्र रवि लामिछाने हो जय रवि सर,1
अहिलेको समयमा सबैको हातमा एन्ड्रोइट मोबाइल छ र पटक पटक  भिजिट भिसामा दुबईमा पुर्याएको र अलपत्र परेको समाचार आई रहदा पनि आखा चिम्लेर भिजिट भिसामा जानेको पनि कम्जोरि हो बाध्यता आआफ्नो ठाउँमा हुन्छ ,0
रबि जि पनि धेरै बोल्नु हुन्छ  सिधा आफ्नो कुरा राखे हुन्छ नि आफै बोल्दैमा ७८ मिनेट खाइ दिने अनि ,0
नमस्ते रबि दाइ रबि सर को सपोटर जति यता हाजी हुनुred_heartred_heartred_heartred_heartred_heart,2
कानुन भन्दा माथि medical माफियाहरु होइन सरकार र कानुन को पालना नगर्नेलाई सिल गर्नु पर्छ,0
हजुर जस्तै व्यक्तिको कमि छ हाम्रो देश नेपाल मा सलाम छ हजुरलाई दुखि पिडित को आसा र भरोसा बनिदीनु भयेको मा,1
धन्यवाद folded_hands,1
रबी र अपिलको काम लाई सलाम,1
य दाजु अब आउ राजनीती मा कती टिभीमा कराउने आउ राजनीती मा हामी साथमा छौ,2
भारत र चाइना को सिमाना तिर को पनि खबर ल्याउनु पर्यो रबि सर लिपु लेख लिपियाधुरा र काला पानी को मुद्दा के भयो कता हरायो यस्को समाचार ल्याउनु पर्यो रबि सर,2
ग्यालेक्सि 4 k मा सम्पर्क गर्ने नम्बर पाउन पाए आभारि हुने थिए  हजुरहरु कसैलाई जानकारि छ भने उपलब्ध गराईदिनु भए आभारि हुने थिए folded_handsfolded_handsfolded_hands,2
रबि सर नमस्कार यस्ता अपराधि हरु काे अनुहारु  किन blur गरेर देखाउनु हुन्छ यस्ता अपराधि लाई त सबै ले चिनुन्,0
आदरणीय रबि लामिछाने दाई हजुर नै हो नेपाली जनता काे दुख को हिराे ॥,1
on the spot no if no but किन्तुपरन्तु केही हैन यो स्कूल जसरी नै बन्द गरिनुपर्छसाला खाते शिक्षकहरूतिमीहरूको छोरीबेटी छ भने हामी पनि यातना दिन्छौ कस्तो हुन्छ तिमीहरूलाई,0
सलाम छ रभि सरsmiling_face_with_hearteyessmiling_face_with_hearteyessmiling_face_with_hearteyessmiling_face_with_hearteyessmiling_face_with_hearteyessmiling_face_with_hearteyes,1
सिधा कुरा एकदम समय सान्दर्भिक छ तितो सधैं सत्य हुन्छ मलाई त सदैव मन पर्ने मान्छे हुनु हुन्छ रबि दाइ,1
देशमा राेजगार छैन  कस्ताे बिजाेग  देशमा राेजगार छ त खाली राजनैतिक गुलामहरूकाे लुटेराहरूकाे फटाहा दलालहरूकाे गुण्डाहरूकाे ,0
रबिलानेछाने दाजुलाइ मेरो अनुरोध छ अगर नेपाल् र नेपाली प्रती अलिकति माया छ भने mcc को बिरोधमा सडकमा उत्रनुपरो बिप्लपको साथमा होइन भने टेलिभिजनमा लराएर काम हुदैन देश छ रपो हामी छौ देश छैन भने केही छैन,2
